{
  "scenario_id": "S5_prot_health",
  "seed": 1304,
  "pano_id": "SIM-00001",
  "pano_type": "1600kVA-dahili",
  "duration_h": 72.0,
  "sample_period_s": 900.0,
  "generated_at": "2026-09-14T13:01:50+00:00",
  "profile": "karma",
  "season": "yaz",
  "data_file": "S5_prot_health.csv",
  "labels": [
    {
      "t_start": "2026-07-07T00:00:00+00:00",
      "t_end": "2026-07-09T00:00:00+00:00",
      "type": "protection_health_loss",
      "point": "PANEL",
      "expect": [
        "ALM-PROT-HEALTH"
      ],
      "severity": "P1",
      "l0_breach_at": null
    }
  ]
}
