{
  "scenario_id": "S13_sensor_nonlin",
  "seed": 1304,
  "pano_id": "SIM-00001",
  "pano_type": "1600kVA-dahili",
  "duration_h": 720.0,
  "sample_period_s": 900.0,
  "generated_at": "2026-09-19T17:44:56+00:00",
  "profile": "karma",
  "season": "yaz",
  "data_file": "S13_sensor_nonlin.csv",
  "labels": [
    {
      "t_start": "2026-07-13T00:00:00+00:00",
      "t_end": "2026-08-05T00:00:00+00:00",
      "type": "loose_connection",
      "point": "DSYA3_L2",
      "expect": [
        "ALM-K-WARN",
        "ALM-K-ALM",
        "ALM-THR-TERM-WARN",
        "ALM-THR-TERM-ALM"
      ],
      "severity": "P2",
      "not_expect": [
        "ALM-I-OVER",
        "ALM-DQ-DRIFT"
      ],
      "params": {
        "k_growth_pct": 200,
        "load_multiplier": 0.95
      },
      "l0_breach_at": null
    }
  ],
  "unmodelled_physics": [
    "sensor_nonlinearity"
  ]
}
