{
  "scenario_id": "S4_arc",
  "seed": 1304,
  "pano_id": "SIM-00001",
  "pano_type": "1600kVA-dahili",
  "duration_h": 72.0,
  "sample_period_s": 900.0,
  "generated_at": "2026-09-14T14:28:53+00:00",
  "profile": "karma",
  "season": "gecis",
  "data_file": "S4_arc.csv",
  "labels": [
    {
      "t_start": "2026-04-07T00:00:00+00:00",
      "t_end": "2026-04-09T00:00:00+00:00",
      "type": "arc",
      "point": "PANEL",
      "expect": [
        "ALM-ARC-TRIP"
      ],
      "severity": "P1",
      "params": {
        "trips": 1
      },
      "l0_breach_at": null
    }
  ]
}
