{
  "scenario_id": "S2_overload",
  "seed": 1304,
  "pano_id": "SIM-00001",
  "pano_type": "1600kVA-dahili",
  "duration_h": 168.0,
  "sample_period_s": 900.0,
  "generated_at": "2026-09-14T13:01:37+00:00",
  "profile": "karma",
  "season": "yaz",
  "data_file": "S2_overload.csv",
  "labels": [
    {
      "t_start": "2026-07-08T08:00:00+00:00",
      "t_end": "2026-07-13T00:00:00+00:00",
      "type": "overload",
      "point": "PANEL",
      "expect": [
        "ALM-I-OVER"
      ],
      "severity": "P2",
      "not_expect": [
        "ALM-K-ALM",
        "ALM-K-WARN"
      ],
      "params": {
        "load_multiplier": 1.35
      },
      "l0_breach_at": "2026-07-08T08:45:00+00:00"
    }
  ]
}
